{
  "wave": "5",
  "run_id": "20260516T0931Z-d192836f1bb0",
  "project_root": "/home/zerlinshen/projects/wave5-trevino",
  "run_manifest_path": "/home/zerlinshen/projects/wave5-trevino/runs/20260516T0931Z-d192836f1bb0/python/run_manifest.json",
  "conda_env_hash": "0000000000000000000000000000000000000000000000000000000000000000",
  "created_at": "2026-05-17T08:35:00Z",
  "plan_revision": "v5.0",
  "parent_canonical_run_id": "20260516T0931Z-d192836f1bb0",
  "parent_v42_ledger_sha": "0000000000000000000000000000000000000000000000000000000000000000",
  "figure_outputs": {
    "F-1B": {
      "png_sha": "1111111111111111111111111111111111111111111111111111111111111111",
      "svg_sha": "2222222222222222222222222222222222222222222222222222222222222222",
      "pdf_sha": "3333333333333333333333333333333333333333333333333333333333333333"
    }
  },
  "reproduction_rate": {
    "overall": 0.5,
    "not_run_count": 3
  }
}
